{
  "policy_version": "0.5.0",
  "registry_file": "source-registry.json",
  "decision_owner": "ai",
  "one_question_one_task": true,
  "source_fan_out": false,
  "registry_order_is_preference": false,
  "task_families": ["gateway_discovery", "joint_quote", "split_outbound", "split_return", "nested_atomic", "surface_access", "refresh"],
  "scoring": {
    "purpose": "advisory capability fit and source diversity; never a source assignment or pruning proof",
    "untried_source_bonus": 8,
    "same_task_repeat_penalty": 18,
    "same_hypothesis_repeat_penalty": 6,
    "payable_role_bonus_for_priced_task": 8,
    "research_role_bonus_for_gateway_task": 4,
    "multi_airport_bonus": 7,
    "flexible_date_bonus": 5,
    "independent_combination_bonus": 10,
    "configured_source_without_endpoint_penalty": 100
  },
  "source_policies": [
    {"source_id": "google-flights", "activation": "global", "task_scores": {"gateway_discovery": 92, "joint_quote": 100, "split_outbound": 90, "split_return": 90, "nested_atomic": 92, "refresh": 100}},
    {"source_id": "ita-matrix", "activation": "global", "task_scores": {"gateway_discovery": 78, "joint_quote": 96, "split_outbound": 82, "split_return": 82, "nested_atomic": 97, "refresh": 88}},
    {"source_id": "skyscanner", "activation": "global", "task_scores": {"gateway_discovery": 94, "joint_quote": 94, "split_outbound": 92, "split_return": 92, "nested_atomic": 72, "refresh": 88}},
    {"source_id": "kayak", "activation": "global", "task_scores": {"gateway_discovery": 90, "joint_quote": 92, "split_outbound": 90, "split_return": 90, "nested_atomic": 85, "refresh": 88}},
    {"source_id": "kiwi-com", "activation": "global", "task_scores": {"gateway_discovery": 95, "joint_quote": 91, "split_outbound": 100, "split_return": 100, "nested_atomic": 100, "refresh": 94}},
    {"source_id": "trip-com", "activation": "global", "task_scores": {"gateway_discovery": 87, "joint_quote": 90, "split_outbound": 94, "split_return": 94, "nested_atomic": 96, "refresh": 94}},
    {"source_id": "flightconnections", "activation": "global", "task_scores": {"gateway_discovery": 85, "nested_atomic": 65}},
    {"source_id": "southwest", "activation": "regional_market_or_identified_operator", "task_scores": {"gateway_discovery": 82, "joint_quote": 78, "split_outbound": 88, "split_return": 88, "refresh": 94}},
    {"source_id": "frontier", "activation": "regional_market_or_identified_operator", "task_scores": {"gateway_discovery": 84, "joint_quote": 78, "split_outbound": 90, "split_return": 90, "refresh": 94}},
    {"source_id": "ryanair", "activation": "regional_market_or_identified_operator", "task_scores": {"gateway_discovery": 90, "joint_quote": 75, "split_outbound": 95, "split_return": 95, "nested_atomic": 70, "refresh": 94}},
    {"source_id": "airasia", "activation": "regional_market_or_identified_operator", "task_scores": {"gateway_discovery": 90, "joint_quote": 76, "split_outbound": 95, "split_return": 95, "nested_atomic": 72, "refresh": 94}},
    {"source_id": "deutsche-bahn", "activation": "regional", "task_scores": {"gateway_discovery": 88, "surface_access": 100, "refresh": 100}},
    {"source_id": "flixbus", "activation": "regional", "task_scores": {"gateway_discovery": 78, "surface_access": 90, "refresh": 96}},
    {"source_id": "rome2rio", "activation": "global", "task_scores": {"gateway_discovery": 86, "surface_access": 65}},
    {"source_id": "busbud", "activation": "global", "task_scores": {"gateway_discovery": 70, "surface_access": 88, "refresh": 90}},
    {"source_id": "trainline", "activation": "regional", "task_scores": {"gateway_discovery": 82, "surface_access": 95, "refresh": 94}},
    {"source_id": "ferryhopper", "activation": "regional", "task_scores": {"gateway_discovery": 80, "surface_access": 95, "refresh": 94}},
    {"source_id": "amtrak", "activation": "regional", "task_scores": {"gateway_discovery": 82, "surface_access": 96, "refresh": 98}},
    {"source_id": "greyhound", "activation": "regional", "task_scores": {"gateway_discovery": 75, "surface_access": 90, "refresh": 96}},
    {"source_id": "transitland", "activation": "global", "task_scores": {"gateway_discovery": 78, "surface_access": 60}},
    {"source_id": "gtfs", "activation": "configured_source", "task_scores": {"gateway_discovery": 82, "surface_access": 78}},
    {"source_id": "openstreetmap", "activation": "global", "task_scores": {"gateway_discovery": 65, "surface_access": 45}},
    {"source_id": "opentripplanner", "activation": "configured_source", "task_scores": {"gateway_discovery": 84, "surface_access": 82}},
    {"source_id": "motis", "activation": "configured_source", "task_scores": {"gateway_discovery": 84, "surface_access": 82}},
    {"source_id": "valhalla", "activation": "configured_source", "task_scores": {"gateway_discovery": 70, "surface_access": 68}}
  ]
}
